source_id,reviewed_at,reviewer,robots_url,robots_status,terms_url,terms_status,recommended_r13_action,recommended_r14_gate,max_request_rate,cache_policy,license_scope,decision,evidence_urls,notes
source_crossref_rest_metadata,2026-06-03T15:31:58+08:00,autoform_agent,https://www.crossref.org/robots.txt,available_allows_public_site_api_docs_reviewed,https://www.crossref.org/documentation/retrieve-metadata/rest-api/access-and-authentication/,terms_reviewed_current_2026_05_doc,metadata_catalog_only,R14/R21 manual public API metadata sample rows=3; repeated polite-pool use requires project contact email,"public REST API access allowed without authentication; use one-off low frequency sampling, cache results, and back off on 4XX",cache responses and avoid repeated identical requests,Crossref REST metadata only; item license metadata may be absent and DOI landing pages or full text remain out of scope,candidate,https://www.crossref.org/robots.txt;https://www.crossref.org/documentation/retrieve-metadata/rest-api/access-and-authentication/;https://www.crossref.org/documentation/retrieve-metadata/rest-api/tips-for-using-the-crossref-rest-api/,"R21 sampled one public API response with rows=3; no DOI landing page, PDF, source file, standard text, paid content, or repeated request was collected."
source_arxiv_api_metadata,2026-06-03T15:31:55+08:00,autoform_agent,https://arxiv.org/robots.txt;https://export.arxiv.org/robots.txt,arxiv_org_available_crawl_delay_15_export_robots_429,https://info.arxiv.org/help/api/tou.html,terms_reviewed_current_api_tou,metadata_catalog_only,R14/R21 keep metadata only; retry only after rate-limit cool-down and no more than one request every three seconds on a single connection,legacy arXiv APIs no more than one request every three seconds and single connection per official API Terms,cache descriptive metadata; link to abs pages; do not mirror PDFs or source files,descriptive metadata under CC0; e-print content license varies by item,candidate,https://arxiv.org/robots.txt;https://export.arxiv.org/robots.txt;https://info.arxiv.org/help/api/tou.html;https://info.arxiv.org/help/license/index.html,"R21 export.arxiv.org robots returned 429 and the follow-up API sample attempt returned Rate exceeded, so no new arXiv raw response was retained."
source_zenodo_records_metadata,2026-06-03T01:20:00+08:00,autoform_agent,https://zenodo.org/robots.txt,robots_fetch_403_requires_manual_review,https://about.zenodo.org/terms/,terms_reviewed,metadata_catalog_only,R14 manual record sample only after item license check,pending per API documentation and site response,cache metadata and record item license per record,record licenses vary by depositor,candidate,https://about.zenodo.org/terms/,Robots fetch returned 403 in this environment so keep manual review gate.
source_nist_materials_data_repository,2026-06-03T01:20:00+08:00,autoform_agent,https://materialsdata.nist.gov/robots.txt,available,https://materialsdata.nist.gov/page/tos,terms_reviewed,metadata_catalog_only,R14 manual record sample only after item license check,manual low frequency until repository API policy is confirmed,cache metadata and record item license per record,content license selected by provider and reliability varies,candidate,https://www.nist.gov/mgi/materials-data-resources;https://materialsdata.nist.gov/page/tos,Repository contains varied data from NIST and broader community so review per item.
source_autoform_public_site_metadata,2026-06-03T01:20:00+08:00,autoform_agent,https://www.autoform.com/robots.txt,available_public_sitemaps,https://www.autoform.com,terms_pending,metadata_catalog_only,R14 manual excerpt only after terms page confirmed,manual low frequency,cache page metadata and avoid repeated requests,official public pages only terms pending,candidate,https://www.autoform.com/robots.txt,Use public terminology only and avoid scraping protected documentation.
